{
 "schema": 1,
 "note": "Reference clips for Suno (audio/synth/metal_sketch.gd): the sketch-a-town-band hook (rising fourths that end open) re-voiced as a riff-heavy speed-metal arrangement in E Mixolydian at three tempos. Bars: 1-2 gallop riff, 3-4 the hook on twin lead, 5-6 the hook an octave up with brass, 7 a tuba oompah march (the joke), 8 one huge chord and a crash. chords = semitones above the low E for each half bar. Hook notes are [bar, beat, MIDI note, beats, harmony note].",
 "rate": 22050,
 "root_midi": 40,
 "tempos": [
  150,
  180,
  210
 ],
 "bars": [
  {
   "kind": "gallop",
   "chords": [
    0,
    0
   ]
  },
  {
   "kind": "gallop",
   "chords": [
    0,
    -2
   ]
  },
  {
   "kind": "hook",
   "chords": [
    5,
    5
   ]
  },
  {
   "kind": "hook",
   "chords": [
    7,
    5
   ]
  },
  {
   "kind": "hook",
   "chords": [
    0,
    -2
   ]
  },
  {
   "kind": "hook",
   "chords": [
    5,
    7
   ]
  },
  {
   "kind": "march",
   "chords": [
    0,
    0
   ]
  },
  {
   "kind": "hit",
   "chords": [
    0,
    0
   ]
  }
 ],
 "hook": [
  [
   2,
   0.0,
   59,
   1.5,
   62
  ],
  [
   2,
   1.5,
   64,
   1.0,
   68
  ],
  [
   2,
   2.5,
   69,
   1.5,
   73
  ],
  [
   3,
   0.0,
   64,
   1.0,
   68
  ],
  [
   3,
   1.0,
   69,
   1.0,
   73
  ],
  [
   3,
   2.0,
   71,
   2.0,
   74
  ],
  [
   4,
   0.0,
   71,
   1.5,
   74
  ],
  [
   4,
   1.5,
   76,
   1.0,
   80
  ],
  [
   4,
   2.5,
   81,
   1.5,
   85
  ],
  [
   5,
   0.0,
   76,
   1.0,
   80
  ],
  [
   5,
   1.0,
   81,
   1.0,
   85
  ],
  [
   5,
   2.0,
   83,
   2.0,
   86
  ]
 ],
 "brass_bars": [
  4,
  5
 ],
 "gain": {
  "rhythm": 0.8,
  "bass": 0.7,
  "kick": 0.7,
  "snare": 0.6,
  "hat": 0.2,
  "crash": 0.5,
  "lead": 0.55,
  "brass": 0.35,
  "tuba": 0.8,
  "stab": 0.5
 }
}
